{
  "SchemaVersion": "APL Sector Map v1.0",
  "DefaultSector": "Others",
  "Sectors": [
    "AI",
    "Software",
    "Semiconductor",
    "Healthcare",
    "Bio",
    "Networking",
    "Industrial",
    "Consumer",
    "Financial",
    "Energy",
    "Materials",
    "Automotive",
    "Aerospace / Defense",
    "Others"
  ],
  "Symbols": {
    "GKOS": "Healthcare",
    "AVAH": "Healthcare",
    "ELVN": "Bio",
    "NSIT": "Software",
    "AVTR": "Bio",
    "NUTX": "Healthcare",
    "LFST": "Healthcare",
    "AMLX": "Bio",
    "ATRC": "Healthcare",
    "SLS": "Bio",
    "PSNL": "Bio",
    "HALO": "Bio",
    "DK": "Energy",
    "PBF": "Energy",
    "RNG": "Software",
    "HNGE": "Healthcare",
    "GTLB": "Software",
    "DINO": "Energy",
    "CLMT": "Energy",
    "SNOW": "Software",
    "NEO": "Healthcare",
    "ABSI": "Bio",
    "ACMR": "Semiconductor",
    "AGL": "Healthcare",
    "AIP": "Semiconductor",
    "ALAB": "AI",
    "ALGM": "Semiconductor",
    "ALKS": "Bio",
    "ALNT": "Industrial",
    "AMAT": "Semiconductor",
    "AMBQ": "Semiconductor",
    "AMD": "AI",
    "AMN": "Healthcare",
    "ANAB": "Bio",
    "APPS": "Software",
    "ATEN": "Networking",
    "ATEX": "Networking",
    "BRKR": "Healthcare",
    "BTSG": "Healthcare",
    "CAT": "Industrial",
    "CDNA": "Healthcare",
    "CMI": "Industrial",
    "CMPS": "Bio",
    "CNC": "Healthcare",
    "COHU": "Semiconductor",
    "CORT": "Bio",
    "CRDO": "AI",
    "CRS": "Industrial",
    "CRWD": "Software",
    "CXW": "Industrial",
    "DDOG": "Software",
    "DELL": "AI",
    "DVA": "Healthcare",
    "ESI": "Materials",
    "EXTR": "Networking",
    "FLEX": "Industrial",
    "FROG": "Software",
    "FTNT": "Networking",
    "GEO": "Industrial",
    "HUM": "Healthcare",
    "ICHR": "Semiconductor",
    "INTC": "Semiconductor",
    "KLIC": "Semiconductor",
    "LQDA": "Bio",
    "LRCX": "Semiconductor",
    "MKSI": "Semiconductor",
    "MRNA": "Bio",
    "MRX": "Financial",
    "MTRN": "Industrial",
    "MU": "Semiconductor",
    "NBIS": "AI",
    "NWPX": "Industrial",
    "ORKA": "Bio",
    "OSCR": "Healthcare",
    "PANW": "Networking",
    "PBI": "Industrial",
    "PDFS": "Semiconductor",
    "PENG": "AI",
    "PLPC": "Industrial",
    "RIOT": "Financial",
    "RVMD": "Bio",
    "SEZL": "Financial",
    "SIMO": "Semiconductor",
    "SNDK": "Semiconductor",
    "STX": "Semiconductor",
    "SYRE": "Bio",
    "TGTX": "Bio",
    "TH": "Consumer",
    "TNGX": "Bio",
    "TVTX": "Bio",
    "TWST": "Bio",
    "TXG": "Bio",
    "UCTT": "Semiconductor",
    "URGN": "Bio",
    "VICR": "Semiconductor",
    "VPG": "Industrial",
    "VSXY": "Consumer",
    "WDC": "Semiconductor",
    "WULF": "AI",
    "WYFI": "AI",
    "CHYM": "Financial",
    "PLSE": "Healthcare",
    "ZETA": "Software",
    "NESR": "Energy",
    "NTRA": "Healthcare",
    "NET": "Networking",
    "MPC": "Energy",
    "PSX": "Energy",
    "HTFL": "Healthcare",
    "HPE": "AI",
    "OKTA": "Software",
    "INSW": "Industrial",
    "ECO": "Industrial",
    "VLO": "Energy",
    "HAE": "Healthcare",
    "TEAM": "Software",
    "DV": "Software",
    "RBRK": "Software",
    "PARR": "Energy",
    "FIVN": "Software",
    "ADPT": "Bio",
    "QLYS": "Software",
    "ILMN": "Bio",
    "BLFS": "Bio",
    "NTNX": "Software",
    "ABCL": "Bio",
    "MGNI": "Software",
    "IQV": "Healthcare",
    "HPQ": "AI",
    "CON": "Healthcare",
    "GH": "Healthcare",
    "SLDE": "Financial"
  }
}
